text,labels,PRODUCT_POSITIVE,PRODUCT_NEGATIVE,PRODUCT_NEUTRAL,PRICE_POSITIVE,PRICE_NEGATIVE,PRICE_NEUTRAL,PLACE_POSITIVE,PLACE_NEGATIVE,PLACE_NEUTRAL,PROMOTION_POSITIVE,PROMOTION_NEGATIVE,PROMOTION_NEUTRAL,OUT_OF_TOPIC,clean_text
Lebih lengkap dari matahari di mall lainnya,['PRODUCT_POSITIVE'],1,0,0,0,0,0,0,0,0,0,0,0,0,lebih lengkap dari matahari di mall lainnya
Koleksi baju dan sepatu anak bagus-bagus.,['PRODUCT_POSITIVE'],1,0,0,0,0,0,0,0,0,0,0,0,0,koleksi baju dan sepatu anak bagus bagus
T4nya sangat besar dan bersih dan semua ada di situ... wes to ora sak bingung 2x tuku ono Hartono moll pokoke wes to...,"['PLACE_POSITIVE', 'PRODUCT_POSITIVE']",1,0,0,0,0,0,1,0,0,0,0,0,0,t4nya sangat besar dan bersih dan semua ada di situ wes to ora sak bingung 2x tuku ono hartono moll pokoke wes to
Penatannya jadi bikin keliayan sempit,['PLACE_POSITIVE'],0,0,0,0,0,0,1,0,0,0,0,0,0,penatannya jadi bikin keliayan sempit
"Luas so ini matahari , pilihan baju a juga banyak , ada sepatu juga banyak deh pokoknya ,","['PLACE_POSITIVE', 'PRODUCT_POSITIVE']",1,0,0,0,0,0,1,0,0,0,0,0,0,luas so ini matahari pilihan baju a juga banyak ada sepatu juga banyak deh pokoknya
"Sukaaaaaak bgt, diskonnya gak kira kira hehehe sukak lah",['PROMOTION_POSITIVE'],0,0,0,0,0,0,0,0,0,1,0,0,0,sukaaaaaak bgt diskonnya gak kira kira hehehe sukak lah
Matahari store sama separti yg lain,['PLACE_NEUTRAL'],0,0,0,0,0,0,0,0,1,0,0,0,0,matahari store sama separti yg lain
kalo hoki dapet baju yg murah tapi kualitas okeeee,"['PRODUCT_POSITIVE', 'PRICE_POSITIVE']",1,0,0,1,0,0,0,0,0,0,0,0,0,kalo hoki dapet baju yg murah tapi kualitas okeeee
"Lengkap dan sering mengeluarkan harga promo yang aneh aneh, walaupun jatuhnya sama saja harganya dengan harga normal/standard. Fasilitas barang barang yang dijual sangat lengkap.","['PROMOTION_NEGATIVE', 'PRICE_NEGATIVE', 'PRODUCT_POSITIVE']",1,0,0,0,1,0,0,0,0,0,1,0,0,lengkap dan sering mengeluarkan harga promo yang aneh aneh walaupun jatuhnya sama saja harganya dengan harga normal standard fasilitas barang barang yang dijual sangat lengkap
Luas sudah lebih komplit dari pada lainnya,"['PLACE_POSITIVE', 'PRODUCT_POSITIVE']",1,0,0,0,0,0,1,0,0,0,0,0,0,luas sudah lebih komplit dari pada lainnya
"The biggest mall in town. Tenant lengkap. Makanan komplit. Karena luas, lega buat jalan2","['PRODUCT_POSITIVE', 'PLACE_POSITIVE']",1,0,0,0,0,0,1,0,0,0,0,0,0,the biggest mall in town tenant lengkap makanan komplit karena luas lega buat jalan2
Pusat perbelanjaan buat beli pakaian.,['OUT_OF_TOPIC'],0,0,0,0,0,0,0,0,0,0,0,0,1,pusat perbelanjaan buat beli pakaian
Tempatnya luas pilihan nya banyak,"['PLACE_POSITIVE', 'PRODUCT_POSITIVE']",1,0,0,0,0,0,1,0,0,0,0,0,0,tempatnya luas pilihan nya banyak
"Tempat belanja yang lumayan lengkap, sama halnya seperti matahari yang lain, tempatnya luas dan nyaman, beragam produk dengan harga dan kualitas cukup lengkap, diskon juga ada","['PRODUCT_POSITIVE', 'PLACE_POSITIVE', 'PROMOTION_POSITIVE', 'PRICE_POSITIVE']",1,0,0,1,0,0,1,0,0,1,0,0,0,tempat belanja yang lumayan lengkap sama halnya seperti matahari yang lain tempatnya luas dan nyaman beragam produk dengan harga dan kualitas cukup lengkap diskon juga ada
Berkunjung kadang2 saja klo pas diajak Anak2...,['OUT_OF_TOPIC'],0,0,0,0,0,0,0,0,0,0,0,0,1,berkunjung kadang2 saja klo pas diajak anak2
Macemnya banyak. 11-12 sama yg di gale dan mall malioboro,['PRODUCT_POSITIVE'],1,0,0,0,0,0,0,0,0,0,0,0,0,macemnya banyak 11 12 sama yg di gale dan mall malioboro
"Banyaaakk sale,tapi sms notif nya mengganggu","['PROMOTION_POSITIVE', 'OUT_OF_TOPIC']",0,0,0,0,0,0,0,0,0,1,0,0,1,banyaaakk sale tapi sms notif nya mengganggu
"Sama seperti matahari yang lain, cm pengalaman saya paling antri bayarnya ya agak lama. Wajar sih.",['OUT_OF_TOPIC'],0,0,0,0,0,0,0,0,0,0,0,0,1,sama seperti matahari yang lain cm pengalaman saya paling antri bayarnya ya agak lama wajar sih
Beli eyeliner di situ request warna hitam dikasih warna hijau wkwkwkwk,['PRODUCT_POSITIVE'],1,0,0,0,0,0,0,0,0,0,0,0,0,beli eyeliner di situ request warna hitam dikasih warna hijau wkwkwkwk
Cuma ke Mi Store doang haha,['OUT_OF_TOPIC'],0,0,0,0,0,0,0,0,0,0,0,0,1,cuma ke mi store doang haha
"Luas, sejuk, pilihan banyak, sangat rekomended.","['PLACE_POSITIVE', 'PRODUCT_POSITIVE']",1,0,0,0,0,0,1,0,0,0,0,0,0,luas sejuk pilihan banyak sangat rekomended
Toko pakain lengkap di mall Hartono Jogyakarta,['PRODUCT_POSITIVE'],1,0,0,0,0,0,0,0,0,0,0,0,0,toko pakain lengkap di mall hartono jogyakarta
Bisa dibilang mall terbesar dijogja,['PLACE_POSITIVE'],0,0,0,0,0,0,1,0,0,0,0,0,0,bisa dibilang mall terbesar dijogja
belanja dimatahari hartono mall enak nyaman banyak pilihan dr anak2 sampai nenek2 top pokoknya,"['PRODUCT_POSITIVE', 'PLACE_POSITIVE']",1,0,0,0,0,0,1,0,0,0,0,0,0,belanja dimatahari hartono mall enak nyaman banyak pilihan dr anak2 sampai nenek2 top pokoknya
Wahana belanja yg sangat menarik,['OUT_OF_TOPIC'],0,0,0,0,0,0,0,0,0,0,0,0,1,wahana belanja yg sangat menarik
"Spacenya luas.
Mudah di jangkau dan pelayanan ramah","['PLACE_POSITIVE', 'OUT_OF_TOPIC']",0,0,0,0,0,0,1,0,0,0,0,0,1,spacenya luas mudah di jangkau dan pelayanan ramah
"Berbagai pilihan merk dan harga, banyak pilihan. Tempat baik dan bersih","['PRODUCT_POSITIVE', 'PLACE_POSITIVE']",1,0,0,0,0,0,1,0,0,0,0,0,0,berbagai pilihan merk dan harga banyak pilihan tempat baik dan bersih
Variasi harga dan produk oke.,"['PRICE_POSITIVE', 'PRODUCT_POSITIVE']",1,0,0,1,0,0,0,0,0,0,0,0,0,variasi harga dan produk oke
Sama juga yang membedakannya adalah tempatnya lebih luas.,['PLACE_POSITIVE'],0,0,0,0,0,0,1,0,0,0,0,0,0,sama juga yang membedakannya adalah tempatnya lebih luas
"Setiap pulang kampung mampir sink dulu,jalan2",['OUT_OF_TOPIC'],0,0,0,0,0,0,0,0,0,0,0,0,1,setiap pulang kampung mampir sink dulu jalan2
Aku sihh sukanyaa koleksi sepatu kalo di matahari..diskonnya juga banyakk,"['PRODUCT_POSITIVE', 'PROMOTION_POSITIVE']",1,0,0,0,0,0,0,0,0,1,0,0,0,aku sihh sukanyaa koleksi sepatu kalo di matahari diskonnya juga banyakk
"Standard mataharilah.. sama aja dimana pun.  Buat konsep baru dong, biar tumpah ruah lagi.",['PLACE_NEUTRAL'],0,0,0,0,0,0,0,0,1,0,0,0,0,standard mataharilah sama aja dimana pun buat konsep baru dong biar tumpah ruah lagi
Salah satu mall terlengkap di jogja. Ada cgv disini,['PRODUCT_POSITIVE'],1,0,0,0,0,0,0,0,0,0,0,0,0,salah satu mall terlengkap di jogja ada cgv disini
Parkir agk jauh.mall luas sekali.wahana anak banyak yg menarik.ada kereta listrik jg.,['PLACE_POSITIVE'],0,0,0,0,0,0,1,0,0,0,0,0,0,parkir agk jauh mall luas sekali wahana anak banyak yg menarik ada kereta listrik jg
Juaranya pakaian dan sepatu diskon.. hehe,"['PRODUCT_POSITIVE', 'PROMOTION_POSITIVE']",1,0,0,0,0,0,0,0,0,1,0,0,0,juaranya pakaian dan sepatu diskon hehe
"Mantap diskonannya , barangnya pun bagus""","['PROMOTION_POSITIVE', 'PRODUCT_POSITIVE']",1,0,0,0,0,0,0,0,0,1,0,0,0,mantap diskonannya barangnya pun bagus
Sepakat sama temen kalau mau nge-mall pilihan nya kalau nggak hartono ya amplas. Ya meski lebih jauh sih. Tapi nyaman ajagitu,"['PLACE_POSITIVE', 'PLACE_NEGATIVE']",0,0,0,0,0,0,1,1,0,0,0,0,0,sepakat sama temen kalau mau nge mall pilihan nya kalau nggak hartono ya amplas ya meski lebih jauh sih tapi nyaman ajagitu
Banyak pilihan baju yang nyaman dengan harga yang sesuai. Pelayanan yang menyenangkan. Pegawai yang ramah.,"['PRODUCT_POSITIVE', 'PRICE_POSITIVE', 'OUT_OF_TOPIC']",1,0,0,1,0,0,0,0,0,0,0,0,1,banyak pilihan baju yang nyaman dengan harga yang sesuai pelayanan yang menyenangkan pegawai yang ramah
"Sama seperti Matahari Department Store di kota lain, di sini pun tempatnya luas dan nyaman. Namun untuk produk batik kurang bervariasi dan kebanyakan harganya relatif mahal. Alangkah baiknya jika dilengkapi dengan batik dengan harga yg terjangkau.","['PRICE_NEGATIVE', 'PRODUCT_NEGATIVE', 'PLACE_POSITIVE']",0,1,0,0,1,0,1,0,0,0,0,0,0,sama seperti matahari department store di kota lain di sini pun tempatnya luas dan nyaman namun untuk produk batik kurang bervariasi dan kebanyakan harganya relatif mahal alangkah baiknya jika dilengkapi dengan batik dengan harga yg terjangkau
Salah satu mall d jogya yg menyatu dengan hotel dan apartemen d jln rung road Utara jogya,['OUT_OF_TOPIC'],0,0,0,0,0,0,0,0,0,0,0,0,1,salah satu mall d jogya yg menyatu dengan hotel dan apartemen d jln rung road utara jogya
lumayan bersih dan suananya adem,['PLACE_POSITIVE'],0,0,0,0,0,0,1,0,0,0,0,0,0,lumayan bersih dan suananya adem
Lengkap serba ada banyak diskon,"['PLACE_POSITIVE', 'PROMOTION_POSITIVE']",0,0,0,0,0,0,1,0,0,1,0,0,0,lengkap serba ada banyak diskon
"Baagus...cm saran saya jangan pulang jm 10 malam, bisa2 kejebak macet diparkiran",['OUT_OF_TOPIC'],0,0,0,0,0,0,0,0,0,0,0,0,1,baagus cm saran saya jangan pulang jm 10 malam bisa2 kejebak macet diparkiran
tempatnya sudah standar Matahari Corps.,['PLACE_NEUTRAL'],0,0,0,0,0,0,0,0,1,0,0,0,0,tempatnya sudah standar matahari corps
"Toko matahari .. tempat komplit dengan berbagai pilihan, mulai Dari pakaian wanita, pria Dan anak-anak,, sepatu, sandal, parfum, macam- macam merk ada disini, pelayanan jg cukup ramah, selalu ada diskon , entah 2 gratis 1 atau potongan 50rb..","['PRODUCT_POSITIVE', 'PROMOTION_POSITIVE']",1,0,0,0,0,0,0,0,0,1,0,0,0,toko matahari tempat komplit dengan berbagai pilihan mulai dari pakaian wanita pria dan anak anak sepatu sandal parfum macam macam merk ada disini pelayanan jg cukup ramah selalu ada diskon entah 2 gratis 1 atau potongan 50rb
"kalo baju disini banyak diskon, tapi koleksi sepatunya sedikit","['PROMOTION_POSITIVE', 'PRODUCT_NEGATIVE']",0,1,0,0,0,0,0,0,0,1,0,0,0,kalo baju disini banyak diskon tapi koleksi sepatunya sedikit
Matahari di sini luas dan barangnya lumayan lengkap!,"['PLACE_POSITIVE', 'PRODUCT_POSITIVE']",1,0,0,0,0,0,1,0,0,0,0,0,0,matahari di sini luas dan barangnya lumayan lengkap
Luas dan banyak pilihan brand,"['PRODUCT_POSITIVE', 'PLACE_POSITIVE']",1,0,0,0,0,0,1,0,0,0,0,0,0,luas dan banyak pilihan brand
Banyak pilihan dan harga terjangkau. Sering promo,"['PRODUCT_POSITIVE', 'PRICE_POSITIVE', 'PROMOTION_POSITIVE']",1,0,0,1,0,0,0,0,0,1,0,0,0,banyak pilihan dan harga terjangkau sering promo
lumayan lengkap. dan up to date,['PRODUCT_POSITIVE'],1,0,0,0,0,0,0,0,0,0,0,0,0,lumayan lengkap dan up to date
"Tempat berbelaja pakaian yang menyenangkan, disini ada berbagai macam brand yg disediakan, dari harga yang terjangkau hingga yg mahal, banyak diskon yang diberikan, tips : jangan terlalu tergiur dengan diskonnya ya, terap berbelanja sesuai dengan kebutuhan dan budget di kantong anda. Salam reviewer","['PRODUCT_POSITIVE', 'PRICE_POSITIVE', 'PROMOTION_POSITIVE']",1,0,0,1,0,0,0,0,0,1,0,0,0,tempat berbelaja pakaian yang menyenangkan disini ada berbagai macam brand yg disediakan dari harga yang terjangkau hingga yg mahal banyak diskon yang diberikan tips jangan terlalu tergiur dengan diskonnya ya terap berbelanja sesuai dengan kebutuhan dan budget di kantong anda salam reviewer
cari hp atau baju tempatnya pas kalo kesini,['OUT_OF_TOPIC'],0,0,0,0,0,0,0,0,0,0,0,0,1,cari hp atau baju tempatnya pas kalo kesini
"seperti toko matahari yang lain, sudah gitu aja.",['OUT_OF_TOPIC'],0,0,0,0,0,0,0,0,0,0,0,0,1,seperti toko matahari yang lain sudah gitu aja
Cukup lengkap and banyak pilihannya,['PRODUCT_POSITIVE'],1,0,0,0,0,0,0,0,0,0,0,0,0,cukup lengkap and banyak pilihannya
"Suka banget ke mall ini.. Banyak pilihan, mall terbesar se yogyakarta.","['PRODUCT_POSITIVE', 'PLACE_POSITIVE']",1,0,0,0,0,0,1,0,0,0,0,0,0,suka banget ke mall ini banyak pilihan mall terbesar se yogyakarta
"Varian pakaian cukup lengkap, harga juga sesuai. Paling suka sama merk NEVADA karena harga terjangkau dan sering ada promo :)","['PRODUCT_POSITIVE', 'PRICE_POSITIVE', 'PROMOTION_POSITIVE']",1,0,0,1,0,0,0,0,0,1,0,0,0,varian pakaian cukup lengkap harga juga sesuai paling suka sama merk nevada karena harga terjangkau dan sering ada promo
Kaya matahari pada umumnya deh ya,['OUT_OF_TOPIC'],0,0,0,0,0,0,0,0,0,0,0,0,1,kaya matahari pada umumnya deh ya
"Tempat andalan buat cari baju sepatu, apalagi kalau lg diskon","['PRODUCT_POSITIVE', 'PROMOTION_POSITIVE']",1,0,0,0,0,0,0,0,0,1,0,0,0,tempat andalan buat cari baju sepatu apalagi kalau lg diskon
Seperti matahari departemen store pada umumnya. Selalu ada diskon.,['PROMOTION_POSITIVE'],0,0,0,0,0,0,0,0,0,1,0,0,0,seperti matahari departemen store pada umumnya selalu ada diskon
Matahari selalu buka diskon yuk datanv,['PROMOTION_POSITIVE'],0,0,0,0,0,0,0,0,0,1,0,0,0,matahari selalu buka diskon yuk datanv
"Oke lah...standar matahari. Sering diskon, jadi senang2 aja.","['PLACE_NEUTRAL', 'PROMOTION_POSITIVE']",0,0,0,0,0,0,0,0,1,1,0,0,0,oke lah standar matahari sering diskon jadi senang2 aja
Kalau ada matahari selalu mampir lah pastinya,['OUT_OF_TOPIC'],0,0,0,0,0,0,0,0,0,0,0,0,1,kalau ada matahari selalu mampir lah pastinya
Mall nya besarr banget... T. O. P,['PLACE_POSITIVE'],0,0,0,0,0,0,1,0,0,0,0,0,0,mall nya besarr banget t o p
matahaaariii... selalu ada diskon dan CS yang siap membantu,"['PROMOTION_POSITIVE', 'OUT_OF_TOPIC']",0,0,0,0,0,0,0,0,0,1,0,0,1,matahaaariii selalu ada diskon dan cs yang siap membantu
Pusat perbelanjaan modern di Kota Yogya,['OUT_OF_TOPIC'],0,0,0,0,0,0,0,0,0,0,0,0,1,pusat perbelanjaan modern di kota yogya
Menawarkan berbelanja dg berbagai diskon menarik,['PROMOTION_POSITIVE'],0,0,0,0,0,0,0,0,0,1,0,0,0,menawarkan berbelanja dg berbagai diskon menarik
Banyak diskon.. Pelayanan kasir ramah..,"['PROMOTION_POSITIVE', 'OUT_OF_TOPIC']",0,0,0,0,0,0,0,0,0,1,0,0,1,banyak diskon pelayanan kasir ramah
Mata bisa jelalatan liat baju baju,['OUT_OF_TOPIC'],0,0,0,0,0,0,0,0,0,0,0,0,1,mata bisa jelalatan liat baju baju
"Kalo ke Jogja harus mampir ke Hartono mall.. Mall nya bagus banyak stand2 menarik, ada tempat bermain utk anak juga",['PLACE_POSITIVE'],0,0,0,0,0,0,1,0,0,0,0,0,0,kalo ke jogja harus mampir ke hartono mall mall nya bagus banyak stand2 menarik ada tempat bermain utk anak juga
Setiap sudut ada kids playground,['PLACE_POSITIVE'],0,0,0,0,0,0,1,0,0,0,0,0,0,setiap sudut ada kids playground
"baju dan celana yang di jual cukup lengkap dan banyak pilihan
dari size kecil sampai besar ada semua
bahkan ada size jumbo juga

kalau di tempat lain biasa nya gak cocok karena ukuran yang selalu ga ada

disini pasti ada untuk size saya
pokok nya recommended banget deh",['PRODUCT_POSITIVE'],1,0,0,0,0,0,0,0,0,0,0,0,0,baju dan celana yang di jual cukup lengkap dan banyak pilihan dari size kecil sampai besar ada semua bahkan ada size jumbo juga kalau di tempat lain biasa nya gak cocok karena ukuran yang selalu ga ada disini pasti ada untuk size saya pokok nya recommended banget deh
Jangan ketinggalan promo diskon setiap saat dan miliki membernya bersama ovo,['PROMOTION_POSITIVE'],0,0,0,0,0,0,0,0,0,1,0,0,0,jangan ketinggalan promo diskon setiap saat dan miliki membernya bersama ovo
Sesekali ngajak anak main game,['OUT_OF_TOPIC'],0,0,0,0,0,0,0,0,0,0,0,0,1,sesekali ngajak anak main game
Tempat belanja rekomen klu sedang di mall,['OUT_OF_TOPIC'],0,0,0,0,0,0,0,0,0,0,0,0,1,tempat belanja rekomen klu sedang di mall
Seperti matahari di mall2. Isinya ya begitu,"['PLACE_POSITIVE', 'PRODUCT_NEUTRAL']",0,0,1,0,0,0,1,0,0,0,0,0,0,seperti matahari di mall2 isinya ya begitu
"Overall umumnya Matahari store gimana,",['PLACE_NEUTRAL'],0,0,0,0,0,0,0,0,1,0,0,0,0,overall umumnya matahari store gimana
Pernah dpt diskon besar celana jeans cinos gtu harganya gk nyampek 100rb,['PROMOTION_POSITIVE'],0,0,0,0,0,0,0,0,0,1,0,0,0,pernah dpt diskon besar celana jeans cinos gtu harganya gk nyampek 100rb
Nah..ini mall luas bgt..bisa manjain kaki kamu guys...dan outlet nya lengkap bisa dijangkau semua kalangan.,"['PLACE_POSITIVE', 'PRODUCT_POSITIVE', 'PRICE_POSITIVE']",1,0,0,1,0,0,1,0,0,0,0,0,0,nah ini mall luas bgt bisa manjain kaki kamu guys dan outlet nya lengkap bisa dijangkau semua kalangan
"Jangan lupa masuk jalur lambat, tepat di seberang JIH",['OUT_OF_TOPIC'],0,0,0,0,0,0,0,0,0,0,0,0,1,jangan lupa masuk jalur lambat tepat di seberang jih
Luas..nyaman..tapi masih banyak toko yang kosong,"['PLACE_POSITIVE', 'PLACE_NEGATIVE']",0,0,0,0,0,0,1,1,0,0,0,0,0,luas nyaman tapi masih banyak toko yang kosong
Krg banyak brgnya tp srg beruntung dpt brg diskonan yg bagus..,"['PRODUCT_NEGATIVE', 'PROMOTION_POSITIVE']",0,1,0,0,0,0,0,0,0,1,0,0,0,krg banyak brgnya tp srg beruntung dpt brg diskonan yg bagus
Mall nya di ringroad utara jauh,['OUT_OF_TOPIC'],0,0,0,0,0,0,0,0,0,0,0,0,1,mall nya di ringroad utara jauh
Kurang up to date modelnya,['PRODUCT_NEGATIVE'],0,1,0,0,0,0,0,0,0,0,0,0,0,kurang up to date modelnya
"Kalau Mau belanja kesini aja eh, super lengkap",['PRODUCT_POSITIVE'],1,0,0,0,0,0,0,0,0,0,0,0,0,kalau mau belanja kesini aja eh super lengkap
Bagus sih barang nya tapi masih kemahalan,"['PRICE_NEGATIVE', 'PRODUCT_POSITIVE']",1,0,0,0,1,0,0,0,0,0,0,0,0,bagus sih barang nya tapi masih kemahalan
"Tempatnya bagus,luas,nyaman dan barang barangnya pun juga bagus","['PLACE_POSITIVE', 'PRODUCT_POSITIVE']",1,0,0,0,0,0,1,0,0,0,0,0,0,tempatnya bagus luas nyaman dan barang barangnya pun juga bagus
"Koleksinya lengkap, terdapat banyak diskon, dan pelayanan ramah.","['PRODUCT_POSITIVE', 'PROMOTION_POSITIVE', 'OUT_OF_TOPIC']",1,0,0,0,0,0,0,0,0,1,0,0,1,koleksinya lengkap terdapat banyak diskon dan pelayanan ramah
Hay guys mo dandan yg cantik bl cosmetic branded ada di sini n ting'al pilih n kita beli clinique n loreal bgs loh,['OUT_OF_TOPIC'],0,0,0,0,0,0,0,0,0,0,0,0,1,hay guys mo dandan yg cantik bl cosmetic branded ada di sini n ting al pilih n kita beli clinique n loreal bgs loh
Ya baru pertama kali datang jadi agak binggung,['OUT_OF_TOPIC'],0,0,0,0,0,0,0,0,0,0,0,0,1,ya baru pertama kali datang jadi agak binggung
"Koleksinya lengkap, banyak pilihan,  banyak diskon cuy..","['PRODUCT_POSITIVE', 'PROMOTION_POSITIVE']",1,0,0,0,0,0,0,0,0,1,0,0,0,koleksinya lengkap banyak pilihan banyak diskon cuy
Standard as many matahari department store.,['PLACE_NEUTRAL'],0,0,0,0,0,0,0,0,1,0,0,0,0,standard as many matahari department store
Bisa dikatakan lebih gede dari jcm ( kayanya),['PLACE_POSITIVE'],0,0,0,0,0,0,1,0,0,0,0,0,0,bisa dikatakan lebih gede dari jcm kayanya
Komplit dan luas bisa buat olah raga jalan kaki Ttp pakai baju rapi atau pun santai ada juga wahana permainan ank2,"['PRODUCT_POSITIVE', 'PLACE_POSITIVE']",1,0,0,0,0,0,1,0,0,0,0,0,0,komplit dan luas bisa buat olah raga jalan kaki ttp pakai baju rapi atau pun santai ada juga wahana permainan ank2
"Bersih, tempat nyaman, model amajing, merk"" terkenal pun ada","['PLACE_POSITIVE', 'PRODUCT_POSITIVE']",1,0,0,0,0,0,1,0,0,0,0,0,0,bersih tempat nyaman model amajing merk terkenal pun ada
Matahari pakaian bagus bagus harga lumayan,"['PRODUCT_POSITIVE', 'PRICE_POSITIVE']",1,0,0,1,0,0,0,0,0,0,0,0,0,matahari pakaian bagus bagus harga lumayan
suka berbelanja di sini banyak promo di hari2 tertentu,['PROMOTION_POSITIVE'],0,0,0,0,0,0,0,0,0,1,0,0,0,suka berbelanja di sini banyak promo di hari2 tertentu
"Tempatnya luas banget, cocok buat main sama temen, keluarga. Enakkk lahh mantul. Itu kesan pertama saya datang me hartono mall..","['PLACE_POSITIVE', 'OUT_OF_TOPIC']",0,0,0,0,0,0,1,0,0,0,0,0,1,tempatnya luas banget cocok buat main sama temen keluarga enakkk lahh mantul itu kesan pertama saya datang me hartono mall
"Pelayanan oke, lighting oke cocok buat selfie","['OUT_OF_TOPIC', 'PLACE_POSITIVE']",0,0,0,0,0,0,1,0,0,0,0,0,1,pelayanan oke lighting oke cocok buat selfie
Departement store semua umat yang dulu rame sekali tpi skrg kurang peminatnya. Tapi kalo udah mendekati hari raya. Hmmm ramenyaa,['OUT_OF_TOPIC'],0,0,0,0,0,0,0,0,0,0,0,0,1,departement store semua umat yang dulu rame sekali tpi skrg kurang peminatnya tapi kalo udah mendekati hari raya hmmm ramenyaa
Hartono Mall ini Mall terlengkap dan terbesar sehingga koleksi nya untuk barang apa aja pasti ada di sini. Saya beli jam tangan Alexandre Christie dan Kamera Mirrorless Fujifilm XA20 di Mall ini,"['PLACE_POSITIVE', 'OUT_OF_TOPIC']",0,0,0,0,0,0,1,0,0,0,0,0,1,hartono mall ini mall terlengkap dan terbesar sehingga koleksi nya untuk barang apa aja pasti ada di sini saya beli jam tangan alexandre christie dan kamera mirrorless fujifilm xa20 di mall ini
sukak luas dan banyak pilihan,"['PLACE_POSITIVE', 'PRODUCT_POSITIVE']",1,0,0,0,0,0,1,0,0,0,0,0,0,sukak luas dan banyak pilihan
"Mall luas, brand2 nya lengkap,  strategis dekat ring road","['PLACE_POSITIVE', 'PRODUCT_POSITIVE']",1,0,0,0,0,0,1,0,0,0,0,0,0,mall luas brand2 nya lengkap strategis dekat ring road
Departemen store yang berada di dalam mal hartono ini menjual produk-produk pakaian dan sepatu dari usia anak dan dewasa dengan berbagai mèrèk dan harga terjangkau..,"['PRODUCT_POSITIVE', 'PRICE_POSITIVE']",1,0,0,1,0,0,0,0,0,0,0,0,0,departemen store yang berada di dalam mal hartono ini menjual produk produk pakaian dan sepatu dari usia anak dan dewasa dengan berbagai m r k dan harga terjangkau
Cukup ... Ada brp lantai sih?!. Kok cuma nemu 1 lantai ya?!. Akunya yg kurang jalan ato memang cuma 1 lantai? . Entahlah .. #efek lelah mungkin..,['OUT_OF_TOPIC'],0,0,0,0,0,0,0,0,0,0,0,0,1,cukup ada brp lantai sih kok cuma nemu 1 lantai ya akunya yg kurang jalan ato memang cuma 1 lantai entahlah efek lelah mungkin
"diskonnya ga begitu banyak.. tp model""nya over all bagus""..","['PROMOTION_NEGATIVE', 'PRODUCT_POSITIVE']",1,0,0,0,0,0,0,0,0,0,1,0,0,diskonnya ga begitu banyak tp model nya over all bagus
"Mall ini saya nilai yang terbaik di kota Yogya, luas, beraih ,toilet klas hotel, lengkap tempat perbelanjaan, lokasi strategis, apalagi berdekatan dng hotel Marriot. Kami swring sekali berkunjung ke Mall diatas",['PLACE_POSITIVE'],0,0,0,0,0,0,1,0,0,0,0,0,0,mall ini saya nilai yang terbaik di kota yogya luas beraih toilet klas hotel lengkap tempat perbelanjaan lokasi strategis apalagi berdekatan dng hotel marriot kami swring sekali berkunjung ke mall diatas
Bagus bagus dan sukak bnget kalo lagi banyak diskon heheheehe,['PROMOTION_POSITIVE'],0,0,0,0,0,0,0,0,0,1,0,0,0,bagus bagus dan sukak bnget kalo lagi banyak diskon heheheehe
"Mall yang luas banget, koleksinya lengkap, parkir luas, ada mushola yang besar juga.","['PRODUCT_POSITIVE', 'PLACE_POSITIVE']",1,0,0,0,0,0,1,0,0,0,0,0,0,mall yang luas banget koleksinya lengkap parkir luas ada mushola yang besar juga
Tempat nyaman.. selalu ada diskon..,"['PLACE_POSITIVE', 'PROMOTION_POSITIVE']",0,0,0,0,0,0,1,0,0,1,0,0,0,tempat nyaman selalu ada diskon
"Menyediakan berbagai macam sepatu,sandal, tas, baju dan lain2 dengan harga lumayan, sesuai dengan kualitas.","['PRODUCT_POSITIVE', 'PRICE_POSITIVE']",1,0,0,1,0,0,0,0,0,0,0,0,0,menyediakan berbagai macam sepatu sandal tas baju dan lain2 dengan harga lumayan sesuai dengan kualitas
Tempat strategis dan kebutuhan untuk keluarga juga tersedia... Lengkap n nyaman...,['PRODUCT_POSITIVE'],1,0,0,0,0,0,0,0,0,0,0,0,0,tempat strategis dan kebutuhan untuk keluarga juga tersedia lengkap n nyaman
Cumn kurang t4 duduk aja smbil nunggu yg milih2,['PLACE_NEGATIVE'],0,0,0,0,0,0,0,1,0,0,0,0,0,cumn kurang t4 duduk aja smbil nunggu yg milih2
Tempat yang sangat luas dan rapi,['PLACE_POSITIVE'],0,0,0,0,0,0,1,0,0,0,0,0,0,tempat yang sangat luas dan rapi
"Mahatari dengan segala koleksinya, bahkan seperti nya semua baju dan sepatu yang ku pakai belinya di matahari.",['PRODUCT_POSITIVE'],1,0,0,0,0,0,0,0,0,0,0,0,0,mahatari dengan segala koleksinya bahkan seperti nya semua baju dan sepatu yang ku pakai belinya di matahari
"Aman nyaman , berbahagia bersama keluarga","['PLACE_POSITIVE', 'OUT_OF_TOPIC']",0,0,0,0,0,0,1,0,0,0,0,0,1,aman nyaman berbahagia bersama keluarga
Baru banyak diskon nih...andai byk duit pasti seneng deh...bs ngeborong ..,['PROMOTION_POSITIVE'],0,0,0,0,0,0,0,0,0,1,0,0,0,baru banyak diskon nih andai byk duit pasti seneng deh bs ngeborong
Sayang tidak ada lifenya kemarin saya banya melihat orang tua ( kakek2 & nenek  ) cukup banyak yg tdk berani naik deng Ekalator akhirnya hanya menunggu dibawah.,['OUT_OF_TOPIC'],0,0,0,0,0,0,0,0,0,0,0,0,1,sayang tidak ada lifenya kemarin saya banya melihat orang tua kakek2 nenek cukup banyak yg tdk berani naik deng ekalator akhirnya hanya menunggu dibawah
"suka sih, cuma barangnya kalah lengkap sama galeria",['PRODUCT_NEGATIVE'],0,1,0,0,0,0,0,0,0,0,0,0,0,suka sih cuma barangnya kalah lengkap sama galeria
Nyaman buat jalan2 bersama keluarga,['PLACE_POSITIVE'],0,0,0,0,0,0,1,0,0,0,0,0,0,nyaman buat jalan2 bersama keluarga
"Mall nya luas dan ngga berlikuliku, jadi gampang :)",['PLACE_POSITIVE'],0,0,0,0,0,0,1,0,0,0,0,0,0,mall nya luas dan ngga berlikuliku jadi gampang
Paling mahal dibanding outlet Matahari lainnya d jgja,['PRICE_NEGATIVE'],0,0,0,0,1,0,0,0,0,0,0,0,0,paling mahal dibanding outlet matahari lainnya d jgja
"Banyak pilihan, blanja jadi nyaman.",['PRODUCT_POSITIVE'],1,0,0,0,0,0,0,0,0,0,0,0,0,banyak pilihan blanja jadi nyaman
"Harganya murah, kualitas bagus, mau nyati baju, sepatu, tas, makeup ada semia","['PRICE_POSITIVE', 'PRODUCT_POSITIVE']",1,0,0,1,0,0,0,0,0,0,0,0,0,harganya murah kualitas bagus mau nyati baju sepatu tas makeup ada semia
"Tempat Belanja kesukaan mama, waktu banyak diskon",['PROMOTION_POSITIVE'],0,0,0,0,0,0,0,0,0,1,0,0,0,tempat belanja kesukaan mama waktu banyak diskon
"Yang jelas sering diskon disini , di semua matahari store",['PROMOTION_POSITIVE'],0,0,0,0,0,0,0,0,0,1,0,0,0,yang jelas sering diskon disini di semua matahari store
Pelayanan karyawan yang baik dan lumayan lengkap pakaian yang dijual,['PRODUCT_POSITIVE'],1,0,0,0,0,0,0,0,0,0,0,0,0,pelayanan karyawan yang baik dan lumayan lengkap pakaian yang dijual
Cukup lengkap dan banyak diskon,"['PRODUCT_POSITIVE', 'PROMOTION_POSITIVE']",1,0,0,0,0,0,0,0,0,1,0,0,0,cukup lengkap dan banyak diskon
Suka ke sini kl pas banyak diskon,['PROMOTION_POSITIVE'],0,0,0,0,0,0,0,0,0,1,0,0,0,suka ke sini kl pas banyak diskon
Pilihannya sedikit hanya 1 lantai saja,['PRODUCT_NEGATIVE'],0,1,0,0,0,0,0,0,0,0,0,0,0,pilihannya sedikit hanya 1 lantai saja
Ini kemaren pas diskon yg gak kira2,['PROMOTION_POSITIVE'],0,0,0,0,0,0,0,0,0,1,0,0,0,ini kemaren pas diskon yg gak kira2
Mall baru yang cukup lengkap,['PRODUCT_POSITIVE'],1,0,0,0,0,0,0,0,0,0,0,0,0,mall baru yang cukup lengkap
