text,labels,PRODUCT_POSITIVE,PRODUCT_NEGATIVE,PRODUCT_NEUTRAL,PRICE_POSITIVE,PRICE_NEGATIVE,PRICE_NEUTRAL,PLACE_POSITIVE,PLACE_NEGATIVE,PLACE_NEUTRAL,PROMOTION_POSITIVE,PROMOTION_NEGATIVE,PROMOTION_NEUTRAL,OUT_OF_TOPIC,clean_text
G3de sih tp diskonnya ga banyak,"['PROMOTION_POSITIVE', 'PLACE_POSITIVE', 'PROMOTION_NEGATIVE']",0,0,0,0,0,0,1,0,0,1,1,0,0,g3de sih tp diskonnya ga banyak
Arteri utara ring road ...mantab,['OUT_OF_TOPIC'],0,0,0,0,0,0,0,0,0,0,0,0,1,arteri utara ring road mantab
Kalo mau belanja yg rada murah di sini nih...baraangnya juga bagus-bagus,"['PRODUCT_POSITIVE', 'PRICE_POSITIVE']",1,0,0,1,0,0,0,0,0,0,0,0,0,kalo mau belanja yg rada murah di sini nih baraangnya juga bagus bagus
Koleksinya banyak..sakung banyaknya jalannya buat pengunjung sempit,['PRODUCT_POSITIVE'],1,0,0,0,0,0,0,0,0,0,0,0,0,koleksinya banyak sakung banyaknya jalannya buat pengunjung sempit
lengkap untuk mencari pakaian yang diingingkan,['PRODUCT_POSITIVE'],1,0,0,0,0,0,0,0,0,0,0,0,0,lengkap untuk mencari pakaian yang diingingkan
Swalayan yang rekomend kalau ke Jogja,['OUT_OF_TOPIC'],0,0,0,0,0,0,0,0,0,0,0,0,1,swalayan yang rekomend kalau ke jogja
"Salah satu matahari yang barangnya ter upadet, beda dari matahari lainnya",['PRODUCT_POSITIVE'],1,0,0,0,0,0,0,0,0,0,0,0,0,salah satu matahari yang barangnya ter upadet beda dari matahari lainnya
Banyak diskon apalagi mendekati hati raya,['PROMOTION_POSITIVE'],0,0,0,0,0,0,0,0,0,1,0,0,0,banyak diskon apalagi mendekati hati raya
Luas dan lengkap banget. Keliling sampe pegel kakinya,"['PLACE_POSITIVE', 'PRODUCT_POSITIVE']",1,0,0,0,0,0,1,0,0,0,0,0,0,luas dan lengkap banget keliling sampe pegel kakinya
Barang baru lebih cepat update di sini,['PRODUCT_POSITIVE'],1,0,0,0,0,0,0,0,0,0,0,0,0,barang baru lebih cepat update di sini
"Cocok untuk beli barang yang memang kita perlukan.
Banyak Restaurant juga disituuuuu....",['PRODUCT_POSITIVE'],1,0,0,0,0,0,0,0,0,0,0,0,0,cocok untuk beli barang yang memang kita perlukan banyak restaurant juga disituuuuu
Senangnya lihat lihat aja kalau ke hartono mall dulu pernah mbeliin baju buat anak,['OUT_OF_TOPIC'],0,0,0,0,0,0,0,0,0,0,0,0,1,senangnya lihat lihat aja kalau ke hartono mall dulu pernah mbeliin baju buat anak
"Luasssssssss, dan anakku betah di kidzona,",['PLACE_POSITIVE'],0,0,0,0,0,0,1,0,0,0,0,0,0,luasssssssss dan anakku betah di kidzona
Tempat bagus dan lebih besar dari mall lain yang terletak di daerah Jogja.,[],0,0,0,0,0,0,0,0,0,0,0,0,0,tempat bagus dan lebih besar dari mall lain yang terletak di daerah jogja
Banyak pilihan produk kebutuhan sehari hati serta banyak pilihan brand  yang menarik,['PRODUCT_POSITIVE'],1,0,0,0,0,0,0,0,0,0,0,0,0,banyak pilihan produk kebutuhan sehari hati serta banyak pilihan brand yang menarik
"Sama seperti Matahari pada umumnya hehe, tapi barang lebih bervariasi sedikit","['PRODUCT_POSITIVE', 'PLACE_NEUTRAL']",1,0,0,0,0,0,0,0,1,0,0,0,0,sama seperti matahari pada umumnya hehe tapi barang lebih bervariasi sedikit
Barangnya bagus-bagus tetapi ada juga yang terlihat kurang mencolok dibandingkan brand yang ada,"['PRODUCT_POSITIVE', 'PRODUCT_NEGATIVE']",1,1,0,0,0,0,0,0,0,0,0,0,0,barangnya bagus bagus tetapi ada juga yang terlihat kurang mencolok dibandingkan brand yang ada
Cukup bagus untuk mencari pakaian kelas mall,['PRODUCT_POSITIVE'],1,0,0,0,0,0,0,0,0,0,0,0,0,cukup bagus untuk mencari pakaian kelas mall
Tempat perbelanjaan yang sangat lengkap dan luas ..jadi kita akan sangat mudah sekali apabila akan membeli perlengkapan baju celana sepatu atau tas.. dan masih bnyak lagi perlengkapan perlengkapan lainnya..seperti parfum topi sabuk .. jangan sampai melewatkan promo promo diskon menarik dari matahari di momen momen sekarang ini,"['PLACE_POSITIVE', 'PRODUCT_POSITIVE', 'PROMOTION_POSITIVE']",1,0,0,0,0,0,1,0,0,1,0,0,0,tempat perbelanjaan yang sangat lengkap dan luas jadi kita akan sangat mudah sekali apabila akan membeli perlengkapan baju celana sepatu atau tas dan masih bnyak lagi perlengkapan perlengkapan lainnya seperti parfum topi sabuk jangan sampai melewatkan promo promo diskon menarik dari matahari di momen momen sekarang ini
"Bagus, tempatnya luas dan nyaman",['PLACE_POSITIVE'],0,0,0,0,0,0,1,0,0,0,0,0,0,bagus tempatnya luas dan nyaman
"Terkomplit barang-barangnya tempat sangat luas,  terasa nyaman sambil nunggu ibu-belanja","['PRODUCT_POSITIVE', 'OUT_OF_TOPIC']",1,0,0,0,0,0,0,0,0,0,0,0,1,terkomplit barang barangnya tempat sangat luas terasa nyaman sambil nunggu ibu belanja
SPG cukup ramah dalam melayani pembeli,['OUT_OF_TOPIC'],0,0,0,0,0,0,0,0,0,0,0,0,1,spg cukup ramah dalam melayani pembeli
seperti counter matahari lainnya.karna ada di mall besar dan interiir bagus displaypun keliatan lebih menarik dan pilihan juga lebih banyak pastinya.kalo untuk harga akadang berbeda..,"['PLACE_POSITIVE', 'PRODUCT_POSITIVE', 'PRICE_NEGATIVE']",1,0,0,0,1,0,1,0,0,0,0,0,0,seperti counter matahari lainnya karna ada di mall besar dan interiir bagus displaypun keliatan lebih menarik dan pilihan juga lebih banyak pastinya kalo untuk harga akadang berbeda
"Matahari nya sangat lengkap, barang-barang yang ditawarkan sangat bervariasi",['PRODUCT_POSITIVE'],1,0,0,0,0,0,0,0,0,0,0,0,0,matahari nya sangat lengkap barang barang yang ditawarkan sangat bervariasi
Sama dengan matahari yang lain,['OUT_OF_TOPIC'],0,0,0,0,0,0,0,0,0,0,0,0,1,sama dengan matahari yang lain
cari sepatu anak...yang katanya murah,"['PRODUCT_POSITIVE', 'OUT_OF_TOPIC', 'PRICE_NEUTRAL']",1,0,0,0,0,1,0,0,0,0,0,0,1,cari sepatu anak yang katanya murah
Pakaiannya lengkap dan kualitasnya terjamin,['PRODUCT_POSITIVE'],1,0,0,0,0,0,0,0,0,0,0,0,0,pakaiannya lengkap dan kualitasnya terjamin
Siapkan budget belanjanya......sayang ga ada outlet miniso,"['PRICE_NEGATIVE', 'PLACE_NEGATIVE']",0,0,0,0,1,0,0,1,0,0,0,0,0,siapkan budget belanjanya sayang ga ada outlet miniso
Tempat utk menghabiskan waktu saat liburan,['OUT_OF_TOPIC'],0,0,0,0,0,0,0,0,0,0,0,0,1,tempat utk menghabiskan waktu saat liburan
Tmpatnya lumayan mudah di temukan kok di dalem mall,"['PRODUCT_POSITIVE', 'PLACE_POSITIVE']",1,0,0,0,0,0,1,0,0,0,0,0,0,tmpatnya lumayan mudah di temukan kok di dalem mall
Tempat yang oke buat cari barang barang bagus,['PRODUCT_POSITIVE'],1,0,0,0,0,0,0,0,0,0,0,0,0,tempat yang oke buat cari barang barang bagus
Yah....sama spt sun2 yg lain,['OUT_OF_TOPIC'],0,0,0,0,0,0,0,0,0,0,0,0,1,yah sama spt sun2 yg lain
"panjang mall nya...suka disini ada parkson..tenant cukup lengkap..parkir vip 20rb enak klo dpt dpn..seharian tarif flat..
klo di b1 b2 parkir biasa 5000","['PLACE_POSITIVE', 'OUT_OF_TOPIC']",0,0,0,0,0,0,1,0,0,0,0,0,1,panjang mall nya suka disini ada parkson tenant cukup lengkap parkir vip 20rb enak klo dpt dpn seharian tarif flat klo di b1 b2 parkir biasa 5000
Banyak diskon cocok buat mahasiswa,['PROMOTION_POSITIVE'],0,0,0,0,0,0,0,0,0,1,0,0,0,banyak diskon cocok buat mahasiswa
"Banyak diskon, dan brand nya lengkapn","['PROMOTION_POSITIVE', 'PRODUCT_POSITIVE']",1,0,0,0,0,0,0,0,0,1,0,0,0,banyak diskon dan brand nya lengkapn
"Mall terbesar, ter ramai di Jogja.","['PLACE_POSITIVE', 'OUT_OF_TOPIC']",0,0,0,0,0,0,1,0,0,0,0,0,1,mall terbesar ter ramai di jogja
Baru banyak diskon akhir tahun.. krn strategi pengaturan harga di matahari sebaiknya kalau belanja rombongan.. jadi bisa manfaatin diskonnya & diatur belanjanya supaya diskon termanfaatkan optimal..,"['PROMOTION_POSITIVE', 'PRICE_NEGATIVE', 'PROMOTION_NEUTRAL', 'OUT_OF_TOPIC']",0,0,0,0,1,0,0,0,0,1,0,1,1,baru banyak diskon akhir tahun krn strategi pengaturan harga di matahari sebaiknya kalau belanja rombongan jadi bisa manfaatin diskonnya diatur belanjanya supaya diskon termanfaatkan optimal
Fashion store yang cukup lengkap,['PRODUCT_POSITIVE'],1,0,0,0,0,0,0,0,0,0,0,0,0,fashion store yang cukup lengkap
"matahari departemen store ini terletak di paling belakang hartono mall. kalau masuk dari pintu utama belok kanan, naik eskalator paling ujung. sama seperti matahari lainnya, disini dijual berbagai kebutuhan fashion pria wanita anak2. harga dan kualitas bersaing.","['PRODUCT_POSITIVE', 'PRICE_NEGATIVE', 'OUT_OF_TOPIC']",1,0,0,0,1,0,0,0,0,0,0,0,1,matahari departemen store ini terletak di paling belakang hartono mall kalau masuk dari pintu utama belok kanan naik eskalator paling ujung sama seperti matahari lainnya disini dijual berbagai kebutuhan fashion pria wanita anak2 harga dan kualitas bersaing
"Buang sampah pd tempatnya. Jaga kebersihan, bertambahlah pahala.",['OUT_OF_TOPIC'],0,0,0,0,0,0,0,0,0,0,0,0,1,buang sampah pd tempatnya jaga kebersihan bertambahlah pahala
"Mall yang nyaman dan bagus, banyak tempat permainan untuk anak2,  pilihan kuliner yang lengkap",['PLACE_POSITIVE'],0,0,0,0,0,0,1,0,0,0,0,0,0,mall yang nyaman dan bagus banyak tempat permainan untuk anak2 pilihan kuliner yang lengkap
Mayan akhir tahun banyaak diskon..buruaaan,['PROMOTION_POSITIVE'],0,0,0,0,0,0,0,0,0,1,0,0,0,mayan akhir tahun banyaak diskon buruaaan
Luas banget... Klo pas sma keluarga trus mencar bingung cari2... Sma kaya bingung cariin parkir,['PLACE_POSITIVE'],0,0,0,0,0,0,1,0,0,0,0,0,0,luas banget klo pas sma keluarga trus mencar bingung cari2 sma kaya bingung cariin parkir
parkir luas...bangunan oke...sistem pelayanan baik...tata letak bagus,"['PLACE_POSITIVE', 'OUT_OF_TOPIC']",0,0,0,0,0,0,1,0,0,0,0,0,1,parkir luas bangunan oke sistem pelayanan baik tata letak bagus
"Keren tempatnya, besar, sejuk. Btw pohon natalnya gede dan bagus bngt :v","['PLACE_POSITIVE', 'OUT_OF_TOPIC']",0,0,0,0,0,0,1,0,0,0,0,0,1,keren tempatnya besar sejuk btw pohon natalnya gede dan bagus bngt v
Tempatnya bagus dan banyak pilihan store terutama buay ank kpopers yang suka nature republik disana ada storenya,['PLACE_POSITIVE'],0,0,0,0,0,0,1,0,0,0,0,0,0,tempatnya bagus dan banyak pilihan store terutama buay ank kpopers yang suka nature republik disana ada storenya
"Loading area sekarng sdh ada palang parkir, moso tiap hari berkunjung kesana kudu mbayar parkir, bkn karyawan loh, cmn sbntr doang 5 mnt palingan",['OUT_OF_TOPIC'],0,0,0,0,0,0,0,0,0,0,0,0,1,loading area sekarng sdh ada palang parkir moso tiap hari berkunjung kesana kudu mbayar parkir bkn karyawan loh cmn sbntr doang 5 mnt palingan
"Menjadi tempat yang bisa menjadi pilihan untuk alternatif dari berbagai Outlet Matahari yang tersebar di berbagai tempat yang ada di Yogyakarta. Pastikan juga untuk selalu melakukan check di sekitaran Matahari ini, karena biasanya akan memberikan Diskon - diskon spesial.","['PROMOTION_POSITIVE', 'OUT_OF_TOPIC']",0,0,0,0,0,0,0,0,0,1,0,0,1,menjadi tempat yang bisa menjadi pilihan untuk alternatif dari berbagai outlet matahari yang tersebar di berbagai tempat yang ada di yogyakarta pastikan juga untuk selalu melakukan check di sekitaran matahari ini karena biasanya akan memberikan diskon diskon spesial
"Nyari diskonan baju dan sepatu, pasti sll dapet... :)",['PROMOTION_POSITIVE'],0,0,0,0,0,0,0,0,0,1,0,0,0,nyari diskonan baju dan sepatu pasti sll dapet
"Komplit, nyaman asik dah pokoknya","['PRODUCT_POSITIVE', 'PLACE_POSITIVE']",1,0,0,0,0,0,1,0,0,0,0,0,0,komplit nyaman asik dah pokoknya
Wow tempat belanja dan kuliner yg siiip,['OUT_OF_TOPIC'],0,0,0,0,0,0,0,0,0,0,0,0,1,wow tempat belanja dan kuliner yg siiip
"Paling suka kalo akhir tahun kesini, diskonaannyaa banyak",['PROMOTION_POSITIVE'],0,0,0,0,0,0,0,0,0,1,0,0,0,paling suka kalo akhir tahun kesini diskonaannyaa banyak
Sama kayak matahari lainnya komplit,['PRODUCT_POSITIVE'],1,0,0,0,0,0,0,0,0,0,0,0,0,sama kayak matahari lainnya komplit
"Kalau nasalah pilihan, matahari bs menjadi salah satu destinasi untuk mencaei beragam jenis pakaian",['PRODUCT_POSITIVE'],1,0,0,0,0,0,0,0,0,0,0,0,0,kalau nasalah pilihan matahari bs menjadi salah satu destinasi untuk mencaei beragam jenis pakaian
"Toko Matahari ... Pasti kenal dong, dimana-mana ada cabangnya. Tempat berbelanja pakaian luar/dalam, Kemeja, Dasi, Jas, Kaos , Celana Panjang/Pendek, Jaket, Kosmetika, Aksesoris, Sun glasses, Sepatu, Sandal, Mainan anak, dll",['PRODUCT_POSITIVE'],1,0,0,0,0,0,0,0,0,0,0,0,0,toko matahari pasti kenal dong dimana mana ada cabangnya tempat berbelanja pakaian luar dalam kemeja dasi jas kaos celana panjang pendek jaket kosmetika aksesoris sun glasses sepatu sandal mainan anak dll
Matahari nya lengkappp bgt ada macem2.. Terlengkap dr matahari lain yg prnh kukunjunhi,['PRODUCT_POSITIVE'],1,0,0,0,0,0,0,0,0,0,0,0,0,matahari nya lengkappp bgt ada macem2 terlengkap dr matahari lain yg prnh kukunjunhi
Banyak playground nya.. cocok untuk balita,['PLACE_POSITIVE'],0,0,0,0,0,0,1,0,0,0,0,0,0,banyak playground nya cocok untuk balita
"Oke, lengkap, banyak diskon2 menarik","['PRODUCT_POSITIVE', 'PROMOTION_POSITIVE']",1,0,0,0,0,0,0,0,0,1,0,0,0,oke lengkap banyak diskon2 menarik
"Kalau kesini jangan lupaa ke food courtnya yaa disini lengkap harga terjangkau juga. Semua brand fashion disini ada , makanan juga lengkap. Fasilitas oke","['PRICE_POSITIVE', 'PRODUCT_POSITIVE', 'PLACE_POSITIVE']",1,0,0,1,0,0,1,0,0,0,0,0,0,kalau kesini jangan lupaa ke food courtnya yaa disini lengkap harga terjangkau juga semua brand fashion disini ada makanan juga lengkap fasilitas oke
Seperti matahari2 lain .Cuma Krn di Hartono mall yg luas jd sering agak bingung sy posisinya dmn.,"['PLACE_POSITIVE', 'PLACE_NEUTRAL']",0,0,0,0,0,0,1,0,1,0,0,0,0,seperti matahari2 lain cuma krn di hartono mall yg luas jd sering agak bingung sy posisinya dmn
"Tempatnya nyaman, penempatan barangnya mudah untuk ditemukan dan rapi","['PLACE_NEUTRAL', 'PLACE_POSITIVE']",0,0,0,0,0,0,1,0,1,0,0,0,0,tempatnya nyaman penempatan barangnya mudah untuk ditemukan dan rapi
Wuihhhh kl nda tahan godaan bisa blanja terus nehhj disini...diskone lg gede2an,['PROMOTION_POSITIVE'],0,0,0,0,0,0,0,0,0,1,0,0,0,wuihhhh kl nda tahan godaan bisa blanja terus nehhj disini diskone lg gede2an
Sering banyak diskonan baju disini.. Kalau mau beli baju matahari yang diskonan mending beli disini hehe,['PROMOTION_POSITIVE'],0,0,0,0,0,0,0,0,0,1,0,0,0,sering banyak diskonan baju disini kalau mau beli baju matahari yang diskonan mending beli disini hehe
Layaknya seperti Matahari Store pada umumnya,"['PLACE_NEUTRAL', 'OUT_OF_TOPIC']",0,0,0,0,0,0,0,0,1,0,0,0,1,layaknya seperti matahari store pada umumnya
Tempat berbelanja baju diskon yang berkualitas dan cukup murah. Apabila ingin membeli pakaian atau sepatu untuk keluarga tercinta sangat direkomendasikan ke sini untuk berbelanja.,"['PROMOTION_POSITIVE', 'PRODUCT_POSITIVE', 'PRICE_POSITIVE', 'OUT_OF_TOPIC']",1,0,0,1,0,0,0,0,0,1,0,0,1,tempat berbelanja baju diskon yang berkualitas dan cukup murah apabila ingin membeli pakaian atau sepatu untuk keluarga tercinta sangat direkomendasikan ke sini untuk berbelanja
Mall yg bagus utk jln2 bersama klrg dan teman,['OUT_OF_TOPIC'],0,0,0,0,0,0,0,0,0,0,0,0,1,mall yg bagus utk jln2 bersama klrg dan teman
Bebas pilih semua ada hihi,['PRODUCT_POSITIVE'],1,0,0,0,0,0,0,0,0,0,0,0,0,bebas pilih semua ada hihi
"Walau kadang harganya gak masuk akal, tapi masih suka ke sini buat liat2 diskon.","['PRICE_NEGATIVE', 'PROMOTION_POSITIVE']",0,0,0,0,1,0,0,0,0,1,0,0,0,walau kadang harganya gak masuk akal tapi masih suka ke sini buat liat2 diskon
"parkir luas,.. n konplit butuh endurance untuk keliling tiap lantai",['PLACE_POSITIVE'],0,0,0,0,0,0,1,0,0,0,0,0,0,parkir luas n konplit butuh endurance untuk keliling tiap lantai
"Pakaiannya komplit, . . . . .",['PRODUCT_POSITIVE'],1,0,0,0,0,0,0,0,0,0,0,0,0,pakaiannya komplit
Banyak diskon yang bisa di pilihh,['PROMOTION_POSITIVE'],0,0,0,0,0,0,0,0,0,1,0,0,0,banyak diskon yang bisa di pilihh
Lebih lengkap dari Matahari dept. Store lainnya. Di sini ada brand Isla.,['PRODUCT_POSITIVE'],1,0,0,0,0,0,0,0,0,0,0,0,0,lebih lengkap dari matahari dept store lainnya di sini ada brand isla
Tersedia pakaian dan kebutuhan papan yang lengkap,['PRODUCT_POSITIVE'],1,0,0,0,0,0,0,0,0,0,0,0,0,tersedia pakaian dan kebutuhan papan yang lengkap
"Nyaman, hanya saja terlalu sempit","['PLACE_POSITIVE', 'PLACE_NEGATIVE']",0,0,0,0,0,0,1,1,0,0,0,0,0,nyaman hanya saja terlalu sempit
"Pelayanan ramah, barang cukup lengkap","['OUT_OF_TOPIC', 'PRODUCT_POSITIVE']",1,0,0,0,0,0,0,0,0,0,0,0,1,pelayanan ramah barang cukup lengkap
Pelayanan nya bagus.lengkap merk nya ada semua,"['PRODUCT_POSITIVE', 'OUT_OF_TOPIC']",1,0,0,0,0,0,0,0,0,0,0,0,1,pelayanan nya bagus lengkap merk nya ada semua
Biasa aja....Matahari tetap ada diskonnya...,['PROMOTION_POSITIVE'],0,0,0,0,0,0,0,0,0,1,0,0,0,biasa aja matahari tetap ada diskonnya
"Nyaman, semua ada disini, cocok sebagai tempat ngumpul bersama teman dan keluarga","['PLACE_POSITIVE', 'PRODUCT_POSITIVE', 'OUT_OF_TOPIC']",1,0,0,0,0,0,1,0,0,0,0,0,1,nyaman semua ada disini cocok sebagai tempat ngumpul bersama teman dan keluarga
Sama kayak matahari biasanya... Brandon dll...,['OUT_OF_TOPIC'],0,0,0,0,0,0,0,0,0,0,0,0,1,sama kayak matahari biasanya brandon dll
kualitas barangnya dari dulu selalu bagus dan as always banyak diskon,"['PRODUCT_POSITIVE', 'PROMOTION_POSITIVE']",1,0,0,0,0,0,0,0,0,1,0,0,0,kualitas barangnya dari dulu selalu bagus dan as always banyak diskon
"Banyak pilihan, semuanya bikin ngiler, dari baju sampai model sendal dan sepatu nya jg bkin bingung mau yg mana",['PRODUCT_POSITIVE'],1,0,0,0,0,0,0,0,0,0,0,0,0,banyak pilihan semuanya bikin ngiler dari baju sampai model sendal dan sepatu nya jg bkin bingung mau yg mana
"Cukup bagus, tp sepi pengunjung...",['OUT_OF_TOPIC'],0,0,0,0,0,0,0,0,0,0,0,0,1,cukup bagus tp sepi pengunjung
Tempat belanja cukup nyaman di jogja utara,['PLACE_POSITIVE'],0,0,0,0,0,0,1,0,0,0,0,0,0,tempat belanja cukup nyaman di jogja utara
Saya ke matahari kok ga panas ya?,['OUT_OF_TOPIC'],0,0,0,0,0,0,0,0,0,0,0,0,1,saya ke matahari kok ga panas ya
Standar matahari.. lumayan luas dan banyak pilihan,"['OUT_OF_TOPIC', 'PRODUCT_POSITIVE', 'PLACE_POSITIVE']",1,0,0,0,0,0,1,0,0,0,0,0,1,standar matahari lumayan luas dan banyak pilihan
Jalan jalan liat barang yang ada di mall hartono,['OUT_OF_TOPIC'],0,0,0,0,0,0,0,0,0,0,0,0,1,jalan jalan liat barang yang ada di mall hartono
Banyak diskonan dan pelayanan baik,"['PROMOTION_POSITIVE', 'OUT_OF_TOPIC']",0,0,0,0,0,0,0,0,0,1,0,0,1,banyak diskonan dan pelayanan baik
"Mataharinya lebih luas, jadi kalo milih barang agak santai gaes","['PLACE_POSITIVE', 'OUT_OF_TOPIC']",0,0,0,0,0,0,1,0,0,0,0,0,1,mataharinya lebih luas jadi kalo milih barang agak santai gaes
"Mall yang lengkap untuk belanja dan cuci mata,  fasilitas  parkir yg memadai...","['PRODUCT_POSITIVE', 'PLACE_POSITIVE']",1,0,0,0,0,0,1,0,0,0,0,0,0,mall yang lengkap untuk belanja dan cuci mata fasilitas parkir yg memadai
Belanja murah dan banyak diskon dan bonus sesuai ketentuan,"['PRICE_POSITIVE', 'PROMOTION_POSITIVE']",0,0,0,1,0,0,0,0,0,1,0,0,0,belanja murah dan banyak diskon dan bonus sesuai ketentuan
Salah satu alternatif tbaik dan harga terjangkau di antara distro dan butik,"['PRICE_POSITIVE', 'OUT_OF_TOPIC']",0,0,0,1,0,0,0,0,0,0,0,0,1,salah satu alternatif tbaik dan harga terjangkau di antara distro dan butik
"Matahari store, menyediakan kebutuhan pakaian, pria, wanita dan anak-anak. Tempatnya adem dan bersih.","['PRODUCT_POSITIVE', 'PLACE_POSITIVE']",1,0,0,0,0,0,1,0,0,0,0,0,0,matahari store menyediakan kebutuhan pakaian pria wanita dan anak anak tempatnya adem dan bersih
"Penghilang penat bagi yang suka keramaian, shoppinh dan keliling keliling hanya utk melihat lihat wkwk",['OUT_OF_TOPIC'],0,0,0,0,0,0,0,0,0,0,0,0,1,penghilang penat bagi yang suka keramaian shoppinh dan keliling keliling hanya utk melihat lihat wkwk
"Matahari paling lengkap di Jogja. Luas banget
Cari banyak model cuma dsini. Dibanding di Lippo plaza atau galeria mall","['PRODUCT_POSITIVE', 'PLACE_POSITIVE']",1,0,0,0,0,0,1,0,0,0,0,0,0,matahari paling lengkap di jogja luas banget cari banyak model cuma dsini dibanding di lippo plaza atau galeria mall
Diskonan banyak sekali apalagi akhir tahun,['PROMOTION_POSITIVE'],0,0,0,0,0,0,0,0,0,1,0,0,0,diskonan banyak sekali apalagi akhir tahun
"Lokasi di ujung, lengkap, harga relatif sama dgn yg lain","['PRODUCT_POSITIVE', 'PLACE_NEUTRAL', 'PRICE_NEUTRAL']",1,0,0,0,0,1,0,0,1,0,0,0,0,lokasi di ujung lengkap harga relatif sama dgn yg lain
Tempat belanja paling nyaman di jogja,['PLACE_POSITIVE'],0,0,0,0,0,0,1,0,0,0,0,0,0,tempat belanja paling nyaman di jogja
"Cozy place, diantara mal mal lain di jogjakarta, makanan di food court banyak pilihan, tempat memang kurang luas, view nya bagus","['PLACE_POSITIVE', 'PLACE_NEGATIVE']",0,0,0,0,0,0,1,1,0,0,0,0,0,cozy place diantara mal mal lain di jogjakarta makanan di food court banyak pilihan tempat memang kurang luas view nya bagus
"play groud luas, nyaman, keren..!",['PLACE_POSITIVE'],0,0,0,0,0,0,1,0,0,0,0,0,0,play groud luas nyaman keren
barang barang di sini kurang begitu lengkap dan kurang update menurut saya. lebih menarik di store mall JCM,['PRODUCT_NEGATIVE'],0,1,0,0,0,0,0,0,0,0,0,0,0,barang barang di sini kurang begitu lengkap dan kurang update menurut saya lebih menarik di store mall jcm
"Sangat senang berbelanja disini, barang nya berbeda tidak seperti matahari mall yang lain",['PRODUCT_NEUTRAL'],0,0,1,0,0,0,0,0,0,0,0,0,0,sangat senang berbelanja disini barang nya berbeda tidak seperti matahari mall yang lain
"Tempatnya sangat luas..nyaman, sering ada event yg menarik.",['PLACE_POSITIVE'],0,0,0,0,0,0,1,0,0,0,0,0,0,tempatnya sangat luas nyaman sering ada event yg menarik
Tempat cari diskonan baju celana,['PROMOTION_POSITIVE'],0,0,0,0,0,0,0,0,0,1,0,0,0,tempat cari diskonan baju celana
Bintang 4 dulu yaa.. soalnya tidak lengkap,['PRODUCT_NEGATIVE'],0,1,0,0,0,0,0,0,0,0,0,0,0,bintang 4 dulu yaa soalnya tidak lengkap
Matahari selalu menawarkan harga yg ramah di kantong.  Apalagi setelah pembayaran masih ada diskon,"['PRICE_POSITIVE', 'PROMOTION_POSITIVE']",0,0,0,1,0,0,0,0,0,1,0,0,0,matahari selalu menawarkan harga yg ramah di kantong apalagi setelah pembayaran masih ada diskon
Lebih mahal dr matahari yg lain,['PRICE_NEGATIVE'],0,0,0,0,1,0,0,0,0,0,0,0,0,lebih mahal dr matahari yg lain
kalo sedang diskonan pasti murah-murah dibandingkan dengan store matahari lainnya,['PROMOTION_POSITIVE'],0,0,0,0,0,0,0,0,0,1,0,0,0,kalo sedang diskonan pasti murah murah dibandingkan dengan store matahari lainnya
Bagus dan rada sepi jadi gak ngantri,['OUT_OF_TOPIC'],0,0,0,0,0,0,0,0,0,0,0,0,1,bagus dan rada sepi jadi gak ngantri
"Banyak hype store disini dibanding sama plaza satunya. Segalanya ada, salah satu destinasi kalau mau mencari sesuatu",['PRODUCT_POSITIVE'],1,0,0,0,0,0,0,0,0,0,0,0,0,banyak hype store disini dibanding sama plaza satunya segalanya ada salah satu destinasi kalau mau mencari sesuatu
Departemen storenya tidak terlalu luas dan tidak terlalu kecil. Terdiri dari 1 lantai saja,['PRICE_NEUTRAL'],0,0,0,0,0,1,0,0,0,0,0,0,0,departemen storenya tidak terlalu luas dan tidak terlalu kecil terdiri dari 1 lantai saja
Tempatnya luas dan nyaman buat belanja,['PLACE_POSITIVE'],0,0,0,0,0,0,1,0,0,0,0,0,0,tempatnya luas dan nyaman buat belanja
Belum terlalu ramai.. pintu masuk pengunjung kurang jelas.,['OUT_OF_TOPIC'],0,0,0,0,0,0,0,0,0,0,0,0,1,belum terlalu ramai pintu masuk pengunjung kurang jelas
"Toko serba ada yang sudah terkenal lama di Indonesia,  terletak di salah satu Mall baru di pinggiran jalan ring road Utara",['OUT_OF_TOPIC'],0,0,0,0,0,0,0,0,0,0,0,0,1,toko serba ada yang sudah terkenal lama di indonesia terletak di salah satu mall baru di pinggiran jalan ring road utara
"Mall di Jogja, parkir padat, kalau sudah masuk lumayan nyaman, pusat belanjaan","['PLACE_POSITIVE', 'PLACE_NEUTRAL']",0,0,0,0,0,0,1,0,1,0,0,0,0,mall di jogja parkir padat kalau sudah masuk lumayan nyaman pusat belanjaan
"Luas tetapi juga nyaman.., lengkap untuk sebuah mall","['PLACE_POSITIVE', 'PRODUCT_POSITIVE']",1,0,0,0,0,0,1,0,0,0,0,0,0,luas tetapi juga nyaman lengkap untuk sebuah mall
Kalau menurut saya pilihannya masih lengkap Matahari Jogja City Mall,['PRODUCT_POSITIVE'],1,0,0,0,0,0,0,0,0,0,0,0,0,kalau menurut saya pilihannya masih lengkap matahari jogja city mall
Matahari store  yg sepertinya diperuntukkan kelas mengah ke atas....,['OUT_OF_TOPIC'],0,0,0,0,0,0,0,0,0,0,0,0,1,matahari store yg sepertinya diperuntukkan kelas mengah ke atas
Harganya lebih mahal dari matahari yg lainnya,['PRICE_NEGATIVE'],0,0,0,0,1,0,0,0,0,0,0,0,0,harganya lebih mahal dari matahari yg lainnya
Mall yang nyaman buat belanja,['OUT_OF_TOPIC'],0,0,0,0,0,0,0,0,0,0,0,0,1,mall yang nyaman buat belanja
Mall teristimewa di kota Istimewa Yogyakarta,['OUT_OF_TOPIC'],0,0,0,0,0,0,0,0,0,0,0,0,1,mall teristimewa di kota istimewa yogyakarta
Tempat belanja yg lengkap di jogja utara,['PRODUCT_POSITIVE'],1,0,0,0,0,0,0,0,0,0,0,0,0,tempat belanja yg lengkap di jogja utara
"Nyaman mall nya.....tp belakangan AC ny kurang dingin, dan d setiap counter yg saya singgahi malah tambah panas.semoga diperhatikan oleh pihak Hartono Mall ny terimakasih.","['PLACE_POSITIVE', 'PLACE_NEGATIVE']",0,0,0,0,0,0,1,1,0,0,0,0,0,nyaman mall nya tp belakangan ac ny kurang dingin dan d setiap counter yg saya singgahi malah tambah panas semoga diperhatikan oleh pihak hartono mall ny terimakasih
"Matahari Hartono Mall hampir sama dengan Matahari yang ada di mall2 lain di Jogja..
Beda di Mall'nya aja, Hartono mallnya lebih besar dan lebih kelihatan eksklusive",['PLACE_POSITIVE'],0,0,0,0,0,0,1,0,0,0,0,0,0,matahari hartono mall hampir sama dengan matahari yang ada di mall2 lain di jogja beda di mall nya aja hartono mallnya lebih besar dan lebih kelihatan eksklusive
"Beli sandal, sepau, baju lengkap...sip",['PRODUCT_POSITIVE'],1,0,0,0,0,0,0,0,0,0,0,0,0,beli sandal sepau baju lengkap sip
Pusat perbelanjaan yg nyaman..tempat parkir luas..gedung mewah..terdapat bebagai macam toko,['PLACE_POSITIVE'],0,0,0,0,0,0,1,0,0,0,0,0,0,pusat perbelanjaan yg nyaman tempat parkir luas gedung mewah terdapat bebagai macam toko
Kalau kesini lebih enak pakai go car atau grab parkirnya luas banget bingung cari parkiran,"['PLACE_POSITIVE', 'PLACE_NEGATIVE', 'PRODUCT_POSITIVE']",1,0,0,0,0,0,1,1,0,0,0,0,0,kalau kesini lebih enak pakai go car atau grab parkirnya luas banget bingung cari parkiran
